{
  "id": "primal-trio",
  "name": "The Primal Trio", 
  "description": "Three entities who achieved perfect harmony with their neighboring elements, creating mutual destruction with their opposition",
  "trio_type": "primal",
  "cosmic_role": "Beings who either created primal damage or were created by it - the truth lost to time, locked in eternal opposition",
  "gods": {
    "vorthak": {
      "name": "Vorthak, the Shadow Weaver",
      "domain": "Chaos",
      "aspect": "Corruption",
      "position": 2,
      "drive": "Achieved perfect harmony with Fire and Lightning, creating inevitable mutual destruction with Radiance",
      "philosophy": "Exists in perfect balance with neighboring forces while opposing all order and light",
      "manifestation": "Spreads through Yggdrasil's shadows, marking those who oppose chaos and blessing those who embrace entropy"
    },
    "titanus": {
      "name": "Titanus, the Iron Will",
      "domain": "Physical",
      "aspect": "Discipline", 
      "position": 4,
      "drive": "Achieved perfect harmony with Radiance and Cold, creating inevitable mutual destruction with Lightning",
      "philosophy": "Exists in perfect balance with neighboring forces while opposing all chaotic energy",
      "manifestation": "Strengthens Yggdrasil's trunk, blessing disciplined warriors and marking those who embrace chaos"
    },
    "lumina": {
      "name": "Lumina, the Dawn Bringer",
      "domain": "Radiance",
      "aspect": "Illumination",
      "position": 6, 
      "drive": "Achieved perfect harmony with Cold and Chaos, creating inevitable mutual destruction with Fire",
      "philosophy": "Exists in perfect balance with neighboring forces while opposing all destructive transformation",
      "manifestation": "Illuminates Yggdrasil's canopy, blessing seekers of truth and marking those who spread darkness"
    }
  },
  "trio_dynamics": {
    "rivalry_nature": "Perfect harmony with neighbors creating inevitable mutual destruction with opposition",
    "core_conflict": "Each Primal achieved perfect balance with their two neighboring elements, but this harmony makes them incompatible with their opposite to the point of mutual annihilation",
    "interactions": {
      "vorthak_vs_titanus": "Chaos flows perfectly with Fire and Lightning, but this harmony makes it fundamentally destructive to Physical discipline - mutual destruction is inevitable",
      "lumina_vs_vorthak": "Radiance balances perfectly with Cold and Chaos, but this balance creates total opposition to corrupted shadows - both forces seek complete annihilation of the other",
      "titanus_vs_lumina": "Physical harmonizes with Radiance and Cold, but this unity makes it incompatible with divine illumination - they cannot coexist without mutual destruction"
    },
    "mutual_destruction": "When Primal opposites meet, both forces are consumed in the conflict - neither can survive the encounter unchanged, explaining the devastating effectiveness"
  },
  "damage_mechanics": {
    "intra_trio_effectiveness": "1.66x - Primal gods contest each other for dominance while maintaining their harmonic balance", 
    "cross_trio_effectiveness": "1.99x - Perfect harmonic balance with neighbors creates mutual destruction with opposites",
    "effectiveness_explanation": "Primals achieved such perfect harmony with their neighboring elements that they became fundamentally incompatible with their opposite - mutual annihilation is the only possible outcome",
    "mutual_destruction_principle": "When Primal opposites clash, both forces are consumed in the conflict, explaining why the damage is devastating in both directions"
  },
  "yggdrasil_connection": {
    "vorthak": "Dwells in the shadows between branches, enabling unexpected connections and chaotic growth",
    "titanus": "Reinforces the trunk's strength, providing the disciplined structure that supports all growth",
    "lumina": "Illuminates the canopy, revealing the true nature of Yggdrasil's infinite complexity"
  },
  "mortal_influence": {
    "on_fundamental_trio": "Wages active war against Fundamental control - seeks to liberate mortals from cosmic determinism",
    "on_civilization": "Shapes societies, cultures, and individual development while fighting Fundamental stagnation",
    "on_personal_growth": "Influences how mortals develop their potential in defiance of Fundamental limitations",
    "cross_trio_warfare": {
      "titanus_vs_glacius": "Disciplined action shatters absolute preservation - No crystalline perfection can contain martial will",
      "lumina_vs_voltharion": "Divine illumination banishes raw connection - Ordered light purifies chaotic energy",
      "vorthak_vs_pyrion": "Chaotic corruption overwhelms ordered transformation - Shadow devours all structured flame"
    }
  },
  "historical_significance": {
    "origin_mystery": "The relationship between Primals and their damage types transcends causation - did they create the damage, or did the damage create them? This question exists beyond the linear flow of time",
    "harmonic_achievement": "Each Primal achieved perfect resonance with their two neighboring elements, creating an unprecedented state of balanced power",
    "opposition_consequence": "This perfect harmony made them fundamentally incompatible with their opposite element, creating the mutual destruction dynamic",
    "ongoing_role": "Continue to actively bless followers and mark enemies, unlike the indifferent Fundamentals"
  },
  "worship_and_influence": {
    "direct_worship": "Actively sought - Primals respond to worship and allegiance with tangible blessings",
    "blessing_system": "Grant power, protection, and favor to mortals who follow their path or worship them directly",
    "marking_system": "Mark those who oppose them with curses, misfortune, and vulnerability to their opposing element",
    "territorial_nature": "Unlike Fundamentals, Primals are possessive of their followers and actively hostile to those who serve their enemies"
  },
  "mortal_interactions": {
    "creation_mystery": "None can say whether the Primals created their respective damage types or were created by them - the relationship exists beyond linear time",
    "blessing_criteria": {
      "vorthak_followers": "Those who embrace uncertainty, break false order, and spread beneficial chaos receive his blessing and protection from Radiance",
      "titanus_followers": "Those who pursue disciplined excellence and martial mastery receive his blessing and protection from Lightning", 
      "lumina_followers": "Those who seek truth and illuminate darkness receive her blessing and protection from Fire"
    },
    "marking_consequences": {
      "oppose_vorthak": "Marked with vulnerability to chaos damage and attraction of chaotic misfortune",
      "oppose_titanus": "Marked with weakness against physical damage and inability to maintain discipline under pressure",
      "oppose_lumina": "Marked with vulnerability to radiance damage and affliction with persistent shadows and confusion"
    }
  },
  "future_implications": {
    "potential_outcomes": {
      "vorthak_victory": "Mortal society embraces chaos - infinite creativity but no stability",
      "titanus_victory": "Perfect mortal discipline - absolute order but no innovation",
      "lumina_victory": "Complete mortal enlightenment - perfect knowledge but loss of mystery"
    },
    "balance_necessity": "Their continued rivalry ensures mortals retain freedom of choice and multiple paths to power"
  }
}
